{
  "$schema": "http://json-schema.org/draft-07/schema#",
  "$id": "https://raw.githubusercontent.com/DiamondForgeFr/SaaSFoundry/master/schemas/clustering-rules.schema.json",
  "title": "sf-srs clustering & seeding rules",
  "description": "Shape of `.claude/skills/sf-srs/data/clustering-rules.json`. Pinned by #287 so the data contract is verifiable at commit time instead of implied by the prose that reads it.",
  "type": "object",
  "required": ["version", "finding_kinds", "epic_fr_clustering", "seeding", "coverage_table", "review_loop"],
  "additionalProperties": false,
  "properties": {
    "$schema": {
      "type": "string",
      "description": "Optional pointer to this schema for IDE live validation."
    },
    "version": {
      "type": "integer",
      "const": 1,
      "description": "Schema version. Bump when the shape changes in a non-additive way."
    },
    "description": { "type": "string" },
    "finding_kinds": {
      "type": "array",
      "minItems": 1,
      "items": {
        "type": "object",
        "required": ["kind", "source", "area_heuristic"],
        "additionalProperties": false,
        "properties": {
          "kind": {
            "type": "string",
            "enum": ["endpoint", "ui-flow", "entity", "test", "doc-context"]
          },
          "source": { "type": "string", "minLength": 1 },
          "area_heuristic": { "type": "string", "minLength": 1 }
        }
      }
    },
    "reading_findings": {
      "type": "array",
      "items": { "type": "string", "minLength": 1 }
    },
    "epic_fr_clustering": {
      "type": "object",
      "required": ["order", "steps"],
      "additionalProperties": false,
      "properties": {
        "order": { "type": "string", "minLength": 1 },
        "steps": {
          "type": "array",
          "minItems": 1,
          "items": {
            "type": "object",
            "required": ["id", "name"],
            "additionalProperties": false,
            "properties": {
              "id": { "type": "integer", "minimum": 1 },
              "name": { "type": "string", "minLength": 1 },
              "action": { "type": "string" },
              "rules": {
                "type": "array",
                "items": { "type": "string", "minLength": 1 }
              }
            },
            "anyOf": [{ "required": ["action"] }, { "required": ["rules"] }]
          }
        }
      }
    },
    "seeding": {
      "type": "object",
      "required": ["philosophy", "ds_items", "tc_items", "nfr_items"],
      "additionalProperties": false,
      "properties": {
        "philosophy": { "type": "string", "minLength": 1 },
        "ds_items": { "$ref": "#/definitions/dsItems" },
        "tc_items": { "$ref": "#/definitions/tcItems" },
        "nfr_items": { "$ref": "#/definitions/nfrItems" }
      }
    },
    "coverage_table": {
      "type": "object",
      "required": ["purpose", "template", "red_flag"],
      "additionalProperties": false,
      "properties": {
        "purpose": { "type": "string", "minLength": 1 },
        "template": {
          "type": "array",
          "minItems": 1,
          "items": { "type": "string" }
        },
        "red_flag": { "type": "string", "minLength": 1 }
      }
    },
    "review_loop": {
      "type": "object",
      "required": ["rule", "prompt_template", "branches", "throttle"],
      "additionalProperties": false,
      "properties": {
        "rule": { "type": "string", "minLength": 1 },
        "prompt_template": {
          "type": "array",
          "minItems": 1,
          "items": { "type": "string" }
        },
        "branches": {
          "type": "object",
          "required": ["accept", "edit", "reject", "skip-area"],
          "additionalProperties": false,
          "properties": {
            "accept": { "type": "string", "minLength": 1 },
            "edit": { "type": "string", "minLength": 1 },
            "reject": { "type": "string", "minLength": 1 },
            "skip-area": { "type": "string", "minLength": 1 }
          }
        },
        "throttle": { "type": "string", "minLength": 1 }
      }
    }
  },
  "definitions": {
    "dsItems": {
      "type": "object",
      "required": ["description", "mappings", "grouping_rules"],
      "additionalProperties": false,
      "properties": {
        "description": { "type": "string", "minLength": 1 },
        "mappings": {
          "type": "array",
          "minItems": 1,
          "items": {
            "type": "object",
            "required": ["finding", "title", "description_source"],
            "additionalProperties": false,
            "properties": {
              "finding": { "type": "string", "minLength": 1 },
              "title": { "type": "string", "minLength": 1 },
              "description_source": { "type": "string", "minLength": 1 }
            }
          }
        },
        "grouping_rules": {
          "type": "array",
          "items": { "type": "string", "minLength": 1 }
        }
      }
    },
    "tcItems": {
      "type": "object",
      "required": ["description", "mappings", "todo_for_untested_endpoints"],
      "additionalProperties": false,
      "properties": {
        "description": { "type": "string", "minLength": 1 },
        "mappings": {
          "type": "array",
          "minItems": 1,
          "items": {
            "type": "object",
            "required": ["source", "target_field", "rule"],
            "additionalProperties": false,
            "properties": {
              "source": { "type": "string", "minLength": 1 },
              "target_field": { "type": "string", "minLength": 1 },
              "rule": { "type": "string", "minLength": 1 }
            }
          }
        },
        "todo_for_untested_endpoints": {
          "type": "object",
          "required": ["when", "emit_as", "shape", "reviewer_options"],
          "additionalProperties": false,
          "properties": {
            "when": { "type": "string", "minLength": 1 },
            "emit_as": { "type": "string", "minLength": 1 },
            "shape": {
              "type": "object",
              "required": ["id", "title", "expectedResult", "frRefs"],
              "additionalProperties": false,
              "properties": {
                "id": { "type": "string", "minLength": 1 },
                "title": { "type": "string", "minLength": 1 },
                "expectedResult": { "type": "string", "minLength": 1 },
                "frRefs": {
                  "type": "array",
                  "minItems": 1,
                  "items": { "type": "string", "minLength": 1 }
                }
              }
            },
            "reviewer_options": {
              "type": "array",
              "minItems": 1,
              "items": { "type": "string", "minLength": 1 }
            }
          }
        }
      }
    },
    "nfrItems": {
      "type": "object",
      "required": ["description", "layer1_stack_signals", "layer2_standard_saas_catalogue"],
      "additionalProperties": false,
      "properties": {
        "description": { "type": "string", "minLength": 1 },
        "layer1_stack_signals": {
          "type": "array",
          "minItems": 1,
          "items": {
            "type": "object",
            "required": ["signal", "seeded_nfrs"],
            "additionalProperties": false,
            "properties": {
              "signal": { "type": "string", "minLength": 1 },
              "seeded_nfrs": {
                "type": "array",
                "minItems": 1,
                "items": { "type": "string", "minLength": 1 }
              }
            }
          }
        },
        "layer2_standard_saas_catalogue": {
          "type": "array",
          "minItems": 1,
          "items": {
            "type": "object",
            "required": ["nfr"],
            "additionalProperties": false,
            "properties": {
              "nfr": { "type": "string", "minLength": 1 },
              "always_propose": { "type": "boolean" },
              "condition": { "type": "string", "minLength": 1 }
            }
          }
        }
      }
    }
  }
}
